[
  {
    "id": "refine.steel",
    "name": "Steel",
    "category": "basic",
    "costG": 200,
    "appliesToWeaponGroups": ["sword", "lance", "axe", "dagger", "bow"],
    "description": "Adds +3 to the Weapon's Might.",
    "statBonuses": {
      "might": 3
    }
  },
  {
    "id": "refine.elder",
    "name": "Elder",
    "category": "basic",
    "costG": 200,
    "appliesToWeaponGroups": ["anima", "light", "dark", "curse"],
    "description": "Adds +2 to the Weapon's Might.",
    "statBonuses": {
      "might": 2
    }
  },
  {
    "id": "refine.greater",
    "name": "Greater",
    "category": "basic",
    "costG": 200,
    "appliesToWeaponGroups": ["shiftingStone"],
    "description": "Adds +2 to the Weapon's Might.",
    "statBonuses": {
      "might": 2
    }
  },
  {
    "id": "refine.eerie",
    "name": "Eerie",
    "category": "basic",
    "costG": 600,
    "appliesToWeaponGroups": ["dark", "curse"],
    "description": "If the user initiates combat and their attack hits, the foe becomes Silenced after combat.",
    "tags": ["requires:initiator", "requires:hit", "status:silenced"]
  },
  {
    "id": "refine.short",
    "name": "Short",
    "category": "basic",
    "costG": 1000,
    "appliesToWeaponGroups": ["bow"],
    "description": "This Weapon's Min Range is reduced by 1 (down to a Minimum of 1)",
    "statBonuses": {
      "minRange": -1
    }
  },
  {
    "id": "refine.scalerending",
    "name": "Scalerending",
    "category": "basic",
    "costG": 400,
    "appliesToWeaponGroups": ["sword", "lance", "axe", "dagger", "anima", "shiftingStone", "siege"],
    "description": "Deals effective damage against units with the Scaled trait.",
    "tags": ["effective:scaled"]
  },
  {
    "id": "refine.furflaying",
    "name": "Furflaying",
    "category": "basic",
    "costG": 400,
    "appliesToWeaponGroups": ["sword", "lance", "axe", "dagger", "bow", "anima", "shiftingStone", "siege"],
    "description": "Deals effective damage against units with the Furred trait.",
    "tags": ["effective:furred"]
  },
  {
    "id": "refine.wingclipping",
    "name": "Wingclipping",
    "category": "basic",
    "costG": 400,
    "appliesToWeaponGroups": ["bow", "anima", "siege"],
    "description": "Deals effective damage against units with the Winged trait.",
    "tags": ["effective:winged"]
  },
  {
    "id": "refine.fiendslaying",
    "name": "Fiendslaying",
    "category": "basic",
    "costG": 400,
    "appliesToWeaponGroups": ["sword", "lance", "axe", "bow", "light", "siege"],
    "description": "Deals effective damage against units with the Fiendish trait.",
    "tags": ["effective:fiendish"]
  },
  {
    "id": "refine.poison",
    "name": "Poison",
    "category": "basic",
    "costG": 600,
    "appliesToWeaponGroups": ["dagger", "light"],
    "description": "If the user initiates combat and their attack hits, the foe becomes Poisoned after combat",
    "tags": ["requires:initiator", "requires:hit","status:poisoned"]
  },
  {
    "id": "refine.enchantedatk",
    "name": "Enchanted [Atk]",
    "category": "basic",
    "costG": 400,
    "appliesToWeaponGroups": ["axe", "dark"],
    "description": "The user gains +2 Attack.",
    "statBonuses": {
      "atk": 2
    }
  },
  {
    "id": "refine.enchanteddex",
    "name": "Enchanted [Dex]",
    "category": "basic",
    "costG": 400,
    "appliesToWeaponGroups": ["axe", "light"],
    "description": "The user gains +2 Dexterity.",
    "statBonuses": {
      "dex": 2
    }
  },
  {
    "id": "refine.enchantedspd",
    "name": "Enchanted [Spd]",
    "category": "basic",
    "costG": 400,
    "appliesToWeaponGroups": ["sword", "light"],
    "description": "The user gains +2 Speed.",
    "statBonuses": {
      "spd": 2
    }
  },
  {
    "id": "refine.enchanteddef",
    "name": "Enchanted [Def]",
    "category": "basic",
    "costG": 400,
    "appliesToWeaponGroups": ["lance", "dark"],
    "description": "The user gains +2 Defense.",
    "statBonuses": {
      "def": 2
    }
  },
  {
    "id": "refine.enchantedres",
    "name": "Enchanted [Res]",
    "category": "basic",
    "costG": 400,
    "appliesToWeaponGroups": ["lance", "light"],
    "description": "The user gains +2 Resistance.",
    "statBonuses": {
      "res": 2
    }
  },
  {
    "id": "refine.enchantedluck",
    "name": "Enchanted [Luck]",
    "category": "basic",
    "costG": 400,
    "appliesToWeaponGroups": ["sword", "dark"],
    "description": "The user gains +2 Luck.",
    "statBonuses": {
      "luck": 2
    }
  },
  {
    "id": "refine.mend",
    "name": "Mend",
    "category": "basic",
    "costG": 200,
    "appliesToWeaponGroups": ["staff"],
    "description": "Adds +5 to the Weapon's Power when restoring an ally's HP.",
    "statBonuses": {
      "might": 5
    }
  },
  {
    "id": "refine.restore",
    "name": "Restore",
    "category": "basic",
    "costG": 200,
    "appliesToWeaponGroups": ["staff"],
    "description": "Effect: Heals an adjacent ally's Status Effects",
    "tags": ["statusCure:all"]
  },
  {
    "id": "refine.rescue",
    "name": "Rescue",
    "category": "basic",
    "costG": 600,
    "appliesToWeaponGroups": ["staff"],
    "description": "Effect: Teleports one ally to a space adjacent to the user. Range 1-7.",
    "tags": ["effect:teleport", "target:ally", "requires:adjacentDestination"],
    "statBonuses": {
      "minRange": 1,
      "maxRange": 7
    }
  },
  {
    "id": "refine.berserk",
    "name": "Berserk",
    "category": "basic",
    "costG": 600,
    "appliesToWeaponGroups": ["staff"],
    "description": "Effect: On Hit, inflicts Berserk on one opponent. Range 1-2.",
    "tags": ["status:berserk", "requires:hit", "target:enemy"],
    "statBonuses": {
      "minRange": 1,
      "maxRange": 2
    }
  },
  {
    "id": "refine.break",
    "name": "Break",
    "category": "basic",
    "costG": 600,
    "appliesToWeaponGroups": ["staff"],
    "description": "Effect: On Hit, inflicts Break on one opponent. Range 1-2.",
    "tags": ["status:break", "requires:hit", "target:enemy"],
    "statBonuses": {
      "minRange": 1,
      "maxRange": 2
    }
  },
  {
    "id": "refine.shock",
    "name": "Shock",
    "category": "basic",
    "costG": 600,
    "appliesToWeaponGroups": ["staff"],
    "description": "Effect: On Hit, inflicts Shock on one opponent. Range 1-2.",
    "tags": ["status:shock", "requires:hit", "target:enemy"],
    "statBonuses": {
      "minRange": 1,
      "maxRange": 2
    }
  },
  {
    "id": "refine.silence",
    "name": "Silence",
    "category": "basic",
    "costG": 600,
    "appliesToWeaponGroups": ["staff"],
    "description": "Effect: On Hit, inflicts Silence on one opponent. Range 1-2.",
    "tags": ["status:silenced", "requires:hit", "target:enemy"],
    "statBonuses": {
      "minRange": 1,
      "maxRange": 2
    }
  },
  {
    "id": "refine.faster",
    "name": "Faster",
    "category": "basic",
    "costG": 400,
    "appliesToWeaponGroups": ["strike", "talons", "breath"],
    "description": "+X Speed when transformed, where X is equal to the user's Gauge.",
    "tags": ["when:transformed", "bonus:spd", "scale:gauge"]
  },
  {
    "id": "refine.bulkier",
    "name": "Bulkier",
    "category": "basic",
    "costG": 400,
    "appliesToWeaponGroups": ["strike", "talons", "breath"],
    "description": "+X Defense when transformed, where X is equal to the user's Gauge.",
    "tags": ["when:transformed", "bonus:def", "scale:gauge"]
  },
  {
    "id": "refine.calmed",
    "name": "Calmed",
    "category": "basic",
    "costG": 400,
    "appliesToWeaponGroups": ["strike", "talons", "breath"],
    "description": "+X Resistance when transformed, where X is equal to the user's Gauge.",
    "tags": ["when:transformed", "bonus:res", "scale:gauge"]
  },
  {
    "id": "refine.precise",
    "name": "Precise",
    "category": "basic",
    "costG": 400,
    "appliesToWeaponGroups": ["strike", "talons", "breath"],
    "description": "+X Hit when transformed, where X is equal to the user's Gauge/2 (rounded up).",
    "tags": ["when:transformed", "bonus:hit", "scale:gauge", "divisor:2"]
  },
  {
    "id": "refine.luckier",
    "name": "Luckier",
    "category": "basic",
    "costG": 400,
    "appliesToWeaponGroups": ["strike", "talons", "breath"],
    "description": "+X Avoid when transformed, where X is equal to the user's Gauge/2 (rounded up).",
    "tags": ["when:transformed", "bonus:avoid", "scale:gauge", "divisor:2"]
  },
  {
    "id": "refine.evenstronger",
    "name": "Even Stronger",
    "category": "basic",
    "costG": 200,
    "appliesToWeaponGroups": ["shiftingStone"],
    "description": "Deals 4 Post-Combat Damage on even turns.",
    "tags": ["timing:postCombat", "effect:postCombatDamage:4", "target:enemy", "condition:turnParity:even"]
  },
  {
    "id": "refine.oddshaped",
    "name": "Odd-Shaped",
    "category": "basic",
    "costG": 200,
    "appliesToWeaponGroups": ["shiftingStone"],
    "description": "Deals 3 Post-Combat Damage on odd turns.",
    "tags": ["timing:postCombat", "effect:postCombatDamage:3", "target:enemy", "condition:turnParity:odd"]
  },
  {
    "id": "refine.incapacitating",
    "name": "Incapacitating",
    "category": "basic",
    "costG": 200,
    "appliesToWeaponGroups": ["curse"],
    "description": "If the user initiates combat and their attack hits, the foe becomes Shocked after combat.",
    "tags": ["requires:initiator", "requires:hit", "status:shocked"]
  },
  {
    "id": "refine.enraging",
    "name": "Enraging",
    "category": "basic",
    "costG": 200,
    "appliesToWeaponGroups": ["curse"],
    "description": "If the user initiates combat and their attack hits, the foe becomes Berserk after combat.",
    "tags": ["requires:initiator", "requires:hit", "status:berserk"]
  },
  {
    "id": "refine.enfeebling",
    "name": "Enfeebling",
    "category": "basic",
    "costG": 200,
    "appliesToWeaponGroups": ["curse"],